{"$schema":"https://json-schema.org/draft/2020-12/schema","$id":"urn:open-brain:portable-brain:v1:publication","type":"object","properties":{"actor_id":{"$ref":"urn:open-brain:portable-brain:v1:common#/$defs/actor_id"},"decision_id":{"$ref":"urn:open-brain:portable-brain:v1:common#/$defs/decision_id"},"page_id":{"$ref":"urn:open-brain:portable-brain:v1:common#/$defs/page_id"},"publication_id":{"$ref":"urn:open-brain:portable-brain:v1:common#/$defs/publication_id"},"published_bytes_base64":{"type":"string","minLength":1},"published_path":{"type":"string","pattern":"^(?!/)(?!.*(?:^|/)\\.\\.(?:/|$))[a-zA-Z0-9._/-]+$"},"published_sha256":{"$ref":"urn:open-brain:portable-brain:v1:common#/$defs/digest"},"recorded_at":{"$ref":"urn:open-brain:portable-brain:v1:common#/$defs/timestamp"},"role_claim":{"$ref":"urn:open-brain:portable-brain:v1:common#/$defs/role_claim"},"schema_version":{"const":1},"tenant_id":{"$ref":"urn:open-brain:portable-brain:v1:common#/$defs/tenant_id"}},"required":["actor_id","decision_id","page_id","publication_id","published_bytes_base64","published_path","published_sha256","recorded_at","role_claim","schema_version","tenant_id"],"additionalProperties":false}
