{"actor_id":"actor_123e4567-e89b-42d3-a456-426614174001","decision_id":"decision_123e4567-e89b-42d3-a456-426614174009","page_id":"page_123e4567-e89b-42d3-a456-426614174005","publication_id":"publication_123e4567-e89b-42d3-a456-42661417400a","published_bytes_base64":"LS0tCmFjdG9yX2lkOiAiYWN0b3JfMTIzZTQ1NjctZTg5Yi00MmQzLWE0NTYtNDI2NjE0MTc0MDAxIgptb2RpZmllZF9hdDogIjIwMjYtMDgtMzBUMTI6MTA6MDBaIgpwYWdlX2lkOiAicGFnZV8xMjNlNDU2Ny1lODliLTQyZDMtYTQ1Ni00MjY2MTQxNzQwMDUiCnByaXZhY3k6IHsiYXV0aG9yaXR5Ijp7ImNsb3VkIjpmYWxzZSwiZXh0ZXJuYWxfZWdyZXNzIjpmYWxzZX0sImNvbmZpcm1hdGlvbl9yZWYiOm51bGwsInBvbGljeV92ZXJzaW9uIjoicHJpdmFjeS12MSIsInJlYXNvbiI6InBlcnNvbmFsX2xvY2FsX29ubHkiLCJ0aWVyIjoicGVyc29uYWwifQpwcm92ZW5hbmNlOiBbImNhcHR1cmVfMTIzZTQ1NjctZTg5Yi00MmQzLWE0NTYtNDI2NjE0MTc0MTAwIl0Kcm9sZV9jbGFpbTogeyJhY3Rvcl9pZCI6ImFjdG9yXzEyM2U0NTY3LWU4OWItNDJkMy1hNDU2LTQyNjYxNDE3NDAwMSIsImNhcGFiaWxpdGllcyI6WyJjYXB0dXJlLmFjY2VwdCIsInNwYWNlLndyaXRlIl0sInJvbGVfY2xhaW1faWQiOiJyb2xlX2NsYWltXzEyM2U0NTY3LWU4OWItNDJkMy1hNDU2LTQyNjYxNDE3NDAwMyIsInJvbGVfaWQiOiJyb2xlXzEyM2U0NTY3LWU4OWItNDJkMy1hNDU2LTQyNjYxNDE3NDAwMiIsInRlbmFudF9pZCI6InRlbmFudF8xMjNlNDU2Ny1lODliLTQyZDMtYTQ1Ni00MjY2MTQxNzQwMDAifQpzY2hlbWFfdmVyc2lvbjogMQpzcGFjZV9pZDogInNwYWNlXzEyM2U0NTY3LWU4OWItNDJkMy1hNDU2LTQyNjYxNDE3NDAwNCIKc3RhdHVzOiAiYWN0aXZlIgp0ZW5hbnRfaWQ6ICJ0ZW5hbnRfMTIzZTQ1NjctZTg5Yi00MmQzLWE0NTYtNDI2NjE0MTc0MDAwIgp0aXRsZTogIlN5bnRoZXRpYyIKdHJ1c3Q6ICJvd25lciIKLS0tCgojIFN5bnRoZXRpYwo=","published_path":"content/spaces/studio/notes/page_123e4567-e89b-42d3-a456-426614174005.md","published_sha256":"a6e47db8c08945f9e56e6978496b69813a6803f62ef8a82d66a632dd9913f514","recorded_at":"2026-08-30T12:10:00Z","role_claim":{"actor_id":"actor_123e4567-e89b-42d3-a456-426614174001","capabilities":["capture.accept","space.write"],"role_claim_id":"role_claim_123e4567-e89b-42d3-a456-426614174003","role_id":"role_123e4567-e89b-42d3-a456-426614174002","tenant_id":"tenant_123e4567-e89b-42d3-a456-426614174000"},"schema_version":1,"tenant_id":"tenant_123e4567-e89b-42d3-a456-426614174000"}